{
  "slug": "cherry-mx2a-silent-black",
  "name": "Cherry MX2A Silent Black",
  "vendorSlug": "cannonkeys",
  "type": "silent-linear",
  "housingTop": "nylon",
  "housingBottom": "nylon",
  "stem": "pom",
  "springGrams": {
    "actuation": 60,
    "bottomOut": 100
  },
  "travelMm": 3.7,
  "factoryLubed": true,
  "releasedAt": "2023-08-24",
  "status": "in-production",
  "description": "Silent linear from Cherry's MX2A revision with rubber dampeners on the stem. Shares the standard MX2A Black's 60cN spring but the stem dampener pads shave 0.3mm off total travel. Quiets bottom-out and top-out without losing the MX2A factory lube; office-friendly pick that doesn't fight the typist.",
  "updatedAt": "2026-08-23T00:00:00.000Z"
}
